database  

database  = > student
lots of tables

MySQL

1: data definition language
(working on structure of table)
creation tables, alter , drop,  = > working on tables

2:data manipulation languauge
data manipulation within the table
update insert delete 

3: data Query Language (DQL)
(get insight of the stored data)
select

4: Data control Language(DCL)
grant 

mysql> show databases;
+--------------------+
| Database           |
+--------------------+
| information_schema |
| mysql              |
| performance_schema |
| sakila             |
| student            |
| sys                |
| world              |
+--------------------+
7 rows in set (0.04 sec)
mysql> use student;
Database changed
mysql> show tables;
+-------------------+
| Tables_in_student |
+-------------------+
| user_info         |
+-------------------+
1 row in set (0.00 sec)

mysql> describe user_info;
+-------+--------------+------+-----+---------+-------+
| Field | Type         | Null | Key | Default | Extra |
+-------+--------------+------+-----+---------+-------+
| id    | int          | YES  |     | NULL    |       |
| name  | varchar(100) | YES  |     | NULL    |       |
+-------+--------------+------+-----+---------+-------+
2 rows in set (0.02 sec)

<!-- Data Defnition Language -->
creation of table
=================
mysql> create table student_info (
    -> id int,
    -> name varchar(50),
    -> rollno int,
    -> age int,
    -> imageUrl varchar(100),
    -> marks int);
Query OK, 0 rows affected (0.05 sec)

mysql> describe student_info;
+----------+--------------+------+-----+---------+-------+
| Field    | Type         | Null | Key | Default | Extra |
+----------+--------------+------+-----+---------+-------+
| id       | int          | YES  |     | NULL    |       |
| name     | varchar(50)  | YES  |     | NULL    |       |
| rollno   | int          | YES  |     | NULL    |       |
| age      | int          | YES  |     | NULL    |       |
| imageUrl | varchar(100) | YES  |     | NULL    |       |
| marks    | int          | YES  |     | NULL    |       |
+----------+--------------+------+-----+---------+-------+
6 rows in set (0.00 sec)


<!-- Alter => change the description  -->

mysql> alter table student_info add email varchar(100);
Query OK, 0 rows affected (0.06 sec)
Records: 0  Duplicates: 0  Warnings: 0

mysql> describe student_info;
+----------+--------------+------+-----+---------+-------+
| Field    | Type         | Null | Key | Default | Extra |
+----------+--------------+------+-----+---------+-------+
| id       | int          | YES  |     | NULL    |       |
| name     | varchar(50)  | YES  |     | NULL    |       |
| rollno   | int          | YES  |     | NULL    |       |
| age      | int          | YES  |     | NULL    |       |
| imageUrl | varchar(100) | YES  |     | NULL    |       |
| marks    | int          | YES  |     | NULL    |       |
| email    | varchar(100) | YES  |     | NULL    |       |
+----------+--------------+------+-----+---------+-------+
7 rows in set (0.00 sec)

<!-- table deletion = > drop -->
mysql> drop table user_info;
Query OK, 0 rows affected (0.02 sec)

mysql> show tables;
+-------------------+
| Tables_in_student |
+-------------------+
| student_info      |
+-------------------+
1 row in set (0.00 sec)
<!-- table content delete = > truncate -->
mysql> truncate table user_info;
Query OK, 0 rows affected (0.04 sec)



<!-- DML (Data manipulation language) -->
<!-- rows=> records -->

<!-- insert -->

mysql> insert into student_info (id, name, rollno,marks) values (
1, 'neha', 23, 234);
Query OK, 1 row affected (0.01 sec)

mysql> select * from student_info;
+------+------+--------+------+----------+-------+-------+
| id   | name | rollno | age  | imageUrl | marks | email |
+------+------+--------+------+----------+-------+-------+
|    1 | neha |     23 | NULL | NULL     |   234 | NULL  |
+------+------+--------+------+----------+-------+-------+
1 row in set (0.00 sec)

<!-- row change => update -->
mysql> update student_info set age = 21;
Query OK, 3 rows affected (0.01 sec)
Rows matched: 3  Changed: 3  Warnings: 0

mysql> select * from student_info;
+------+-------+--------+------+----------+-------+-------+
| id   | name  | rollno | age  | imageUrl | marks | email |
+------+-------+--------+------+----------+-------+-------+
|    1 | neha  |     23 |   21 | NULL     |   234 | NULL  |
|    2 | Pooja |     21 |   21 | NULL     |   214 | NULL  |
|    3 | rahul |     29 |   21 | NULL     |    99 | NULL  |
+------+-------+--------+------+----------+-------+-------+
3 rows in set (0.00 sec)

<!-- delete = > only specified rows are deleted
 -->mysql> delete from student_info where rollno = 21;
Query OK, 1 row affected (0.01 sec)

mysql> select * from student_info;
+------+-------+--------+------+----------+-------+-------+
| id   | name  | rollno | age  | imageUrl | marks | email |
+------+-------+--------+------+----------+-------+-------+
|    1 | neha  |     23 |   21 | NULL     |   234 | NULL  |
|    3 | rahul |     29 |   21 | NULL     |    99 | NULL  |
+------+-------+--------+------+----------+-------+-------+
2 rows in set (0.00 sec)



<!-- DQL => insights -->
<!-- select =>  -->

<!-- Data Descriptaion  => 1 -->
<!-- Key  -->
1 : primary key 
columns  => distinct values => 
not null

23
1 neha
2, pooja
23 rahul
null tina

<!-- notnull distinct  -->
mysql> create table marks (
    -> id int primary key,
    -> maths int, science int );
Query OK, 0 rows affected (0.04 sec)

mysql> describe marks;
+---------+------+------+-----+---------+-------+
| Field   | Type | Null | Key | Default | Extra |
+---------+------+------+-----+---------+-------+
| id      | int  | NO   | PRI | NULL    |       |
| maths   | int  | YES  |     | NULL    |       |
| science | int  | YES  |     | NULL    |       |
+---------+------+------+-----+---------+-------+
3 rows in set (0.00 sec)

mysql> insert into marks values (1, 23, 45);
Query OK, 1 row affected (0.01 sec)

mysql> insert into marks (id, science) values (1, 45);
ERROR 1062 (23000): Duplicate entry '1' for key 'marks.PRIMARY'
mysql> insert into marks (id, science) values (4, 45);
Query OK, 1 row affected (0.01 sec)

mysql> select * from marks;
+----+-------+---------+
| id | maths | science |
+----+-------+---------+
|  1 |    23 |      45 |
|  4 |  NULL |      45 |
+----+-------+---------+
2 rows in set (0.00 sec)


<!-- unique => distinct values =
one null value is allowed -->

<!-- not null => values are required -->
<!-- default  -->
mysql> create table marks2 (
    -> id int primary key,
    -> maths int default 0, science int not null );
Query OK, 0 rows affected (0.04 sec)

mysql> describe marks2;
+---------+------+------+-----+---------+-------+
| Field   | Type | Null | Key | Default | Extra |
+---------+------+------+-----+---------+-------+
| id      | int  | NO   | PRI | NULL    |       |
| maths   | int  | YES  |     | 0       |       |
| science | int  | NO   |     | NULL    |       |
+---------+------+------+-----+---------+-------+
3 rows in set (0.00 sec)
